{
  "title": "Technisches Datenblatt – NovuShield",
  "product_name": "NovuShield",
  "product_subtitle": "Die Imprägnierung für mineralische Außenflächen",
  "product_short": "Oberflächenimprägnierung",
  "product_line": "HOME LINE",
  "line_badge": "../../assets/images/badge-homeline.png",
  "product_image": "../../assets/images/products/novushield.png",
  "description": "NovuShield ist eine wasserbasierte hydrophobierende Imprägnierung für saugfähige mineralische Außenflächen. Sie dringt in die Oberfläche ein und verleiht wasser- und schmutzabweisende Eigenschaften. Das Produkt trocknet farblos auf, bildet keinen Film und erhält den natürlichen Charakter der Oberfläche.",
  "advantages": [
    "Wasser- und schmutzabweisende Oberfläche",
    "Erhält die natürliche Optik",
    "Reduziert Grünbelag und Frostschäden",
    "Für viele Außenflächen geeignet",
    "Einfache Anwendung"
  ],
  "properties": [
    "Hydrophobierend",
    "Farblos auftrocknend",
    "Tief eindringend",
    "UV- und alkalibeständig",
    "Gebrauchsfertig"
  ],
  "technical_data_page1": [
    {
      "parameter": "Basis",
      "value": "wasserbasierte Silan-/Siloxan-Formulierung"
    },
    {
      "parameter": "Wirkweise",
      "value": "hydrophobierend"
    },
    {
      "parameter": "Form",
      "value": "flüssig"
    },
    {
      "parameter": "Farbe",
      "value": "milchig; transparent auftrocknend"
    },
    {
      "parameter": "Geruch",
      "value": "schwach, charakteristisch"
    },
    {
      "parameter": "Dichte",
      "value": "ca. 0,9–1,1 kg/l",
      "note": "[ZU PRÜFEN: Prüfnorm fehlt im Team-Input]"
    },
    {
      "parameter": "pH-Wert",
      "value": "ca. 7,4–7,6",
      "note": "[ZU PRÜFEN: Prüfnorm fehlt im Team-Input]"
    },
    {
      "parameter": "Verarbeitungstemperatur",
      "value": "mindestens +5 °C",
      "note": "[ZU PRÜFEN: obere Temperaturgrenze fehlt im Team-Input]"
    },
    {
      "parameter": "Verarbeitung",
      "value": "unverdünnt"
    },
    {
      "parameter": "Auftrag",
      "value": "Gartenspritze, Pinsel, Rolle oder Quast"
    }
  ],
  "technical_data_page2": [
    {
      "parameter": "Verbrauch",
      "condition": "je nach Saugfähigkeit und Struktur des Untergrundes",
      "value": "ca. 80–120 ml/m²"
    },
    {
      "parameter": "Einwirkzeit",
      "value": "ca. 2–4 Stunden"
    },
    {
      "parameter": "Begehbarkeit",
      "value": "nach ca. 12 Stunden"
    },
    {
      "parameter": "Regenfestigkeit",
      "value": "nach ca. 24 Stunden"
    },
    {
      "parameter": "VOC-Gehalt",
      "value": "[ANGABE FEHLT: VOC-Gehalt und Bezugsnorm]",
      "marker": true
    }
  ],
  "applications": "NovuShield eignet sich für die Imprägnierung saugfähiger mineralischer Oberflächen im Außenbereich. Geeignete Einsatzbereiche sind insbesondere Betonpflaster, Natursteinpflaster, Terrassenplatten, Gehwege, Zufahrten, Betonflächen, Betonfertigteile, Klinker, Kalksandstein und Tondachziegel. Nicht geeignet ist das Produkt für Glas, Metall, Kunststoff, Holz, glasierte Keramik sowie lackierte, versiegelte oder bereits imprägnierte Oberflächen.",
  "applications_note": "Bei Anwendungen außerhalb der genannten Einsatzbereiche ist die Eignung vorab zu prüfen.",
  "notes": "Der Untergrund muss saugfähig, sauber, trocken und tragfähig sein. Vor der Anwendung sollte eine Probefläche angelegt werden, um Verträglichkeit und Eindringverhalten zu prüfen. Angrenzende Bauteile aus Glas, Holz, Metall oder Kunststoff sowie Pflanzen vor Produktspritzern schützen; Spritzer unmittelbar mit klarem Wasser entfernen. Nicht bei direkter Sonneneinstrahlung, starkem Wind oder auf aufgeheizten Untergründen einsetzen. Während der Anwendung und mindestens 24 Stunden danach muss trockene und frostfreie Witterung zu erwarten sein. Arbeitsgeräte direkt nach Gebrauch mit Wasser reinigen.",
  "notes_on_page3": true,
  "packaging": [
    {
      "size": "1 Liter",
      "article_number": "24243166-01"
    },
    {
      "size": "5 Liter",
      "article_number": "24243269-01"
    },
    {
      "size": "10 Liter",
      "article_number": "24243272-01"
    },
    {
      "size": "25 Liter",
      "article_number": "24243276-01"
    }
  ],
  "storage": "Kühl, trocken, frostfrei und vor direkter Sonneneinstrahlung geschützt im originalverschlossenen Gebinde lagern. Angebrochene Gebinde gut verschließen und zeitnah verbrauchen. Im ungeöffneten Originalgebinde ist das Produkt mindestens 12 Monate haltbar.",
  "review": {
    "open_points": [
      "Die Produktlinie ist im Team-Input nicht angegeben. Gemäß TDS-Workflow wird für Produkte mit dem Namensbestandteil Novu vorläufig HOME LINE verwendet; die Produktlinie und der zugehörige Badge müssen fachlich bestätigt werden.",
      "Ein freigestelltes Produktbild für assets/images/products/novushield.png liegt nicht vor.",
      "Dichte und pH-Wert sind angegeben, jedoch ohne Prüfnorm oder Messbedingung.",
      "Die obere Verarbeitungstemperatur fehlt.",
      "VOC-Gehalt einschließlich Bezugsnorm fehlt.",
      "Für den Verbrauch fehlt eine material- oder untergrundbezogene Aufschlüsselung; die angegebene Spanne wurde unverändert übernommen.",
      "Das Sicherheitsdatenblatt wird nur auf Anfrage genannt. Bereitstellung und Freigabestand sind zu bestätigen."
    ],
    "changes": [
      "Den angelieferten DOCX-Inhalt in die festen TDS-Abschnitte Produktbeschreibung, Vorteile, Eigenschaften, technische Daten, Anwendung, Hinweise, Gebinde, Lagerung, Entsorgung und Rechtliches überführt.",
      "Die unstrukturiert im Fließtext enthaltenen Verbrauchs- und Zeitangaben als eigenständige technische Kennwerte ausgegeben.",
      "Ausschlüsse aus den Anwendungsgebieten als klaren Satz im Anwendungsblock übernommen.",
      "Den langen Hinweisblock kontrolliert auf Seite 3 platziert, damit der technische Tabellenbereich nicht überläuft.",
      "Nicht gelieferte Freigabeinformationen sichtbar mit Prüfmarkern versehen; keine Kennwerte ergänzt oder geschätzt."
    ],
    "protocol": "E01 DOCX-Teaminput vollständig extrahiert · E02 Pflichtstruktur in TDS-Datenvertrag abgebildet · E03 5 Vorteile und 5 Eigenschaften vorhanden · E04 technischer Kennwertblock aus Eingangsdaten strukturiert · E05 Produktlinie, Produktbild, Prüfnormen, obere Temperaturgrenze und VOC-Gehalt offen · E06 Release-Build muss bis zur Klärung aller Punkte gesperrt bleiben."
  },
  "page_count": 3,
  "logo": "../../assets/images/logos/logo-deepgreen-green.png",
  "keyvisual": "../../assets/images/keyvisual-on-light.png",
  "manual_reference": "Für eine detaillierte Erklärung zur Verwendung des Produktes nutze bitte unsere separate Verarbeitungsanleitung.",
  "sds_reference": "Gefahrenhinweise und Sicherheitsratschläge sind auf den Gebinden und im Sicherheitsdatenblatt zu finden. Das aktuelle Sicherheitsdatenblatt ist auf Anfrage erhältlich.",
  "disposal": "Die Entsorgung muss gemäß den örtlichen Vorschriften erfolgen. Restentleerte Verpackungen können der Wiederverwertung zugeführt werden.",
  "legal": [
    "Diese Hinweise basieren auf unserem aktuellen Wissensstand und unseren Erfahrungen, unter der Voraussetzung, dass unsere Produkte ordnungsgemäß gelagert und eingesetzt werden. Aufgrund unterschiedlicher Materialien und Bedingungen können wir keine Garantie für das Arbeitsergebnis übernehmen. Eine Haftung unsererseits besteht nur bei nachweislichem Vorsatz oder grober Fahrlässigkeit.",
    "Der Anwender ist dafür verantwortlich, die Produkte auf deren Eignung für den vorgesehenen Zweck zu prüfen. Die jeweils aktuelle Produktspezifikation sollte berücksichtigt werden. Änderungen sind vorbehalten. Eventuelle Schutzrechte Dritter sind zu beachten.",
    "Für die Qualität unserer Produkte bürgen wir gemäß unseren Verkaufs- und Lieferbedingungen. Eine Garantie für den Anwendungserfolg wird nicht übernommen. Unsere technischen Datenblätter bieten eine unverbindliche Beratung und erfordern schriftliche Zustimmung für Zusicherungen, die darüber hinausgehen."
  ],
  "final_note": "Beachte bitte das neueste Produktdatenblatt als verbindliche Informationsquelle.",
  "created_date": "19.08.2026"
}
